{
  "protocol_version": "0.1",
  "plan_id": "pln_demo0000000000000003",
  "task_id": "tsk_demo0000000000000001",
  "action_id": "issues.batch_create",
  "principal": "agent@example-project.iam.gserviceaccount.com",
  "request_key_digest": "hmac-sha256:0a1b2c3d4e5f60718293a4b5c6d7e8f90a1b2c3d4e5f60718293a4b5c6d7e8f9",
  "attempts": 1,
  "cancel_requested": false,
  "recovers_operation_id": null,
  "recovery_operation_ids": [
    "op_demo0000000000000004"
  ],
  "error": null,
  "created_at": "2026-10-22T14:00:00.000Z",
  "submitted_at": "2026-10-22T14:00:00.000Z",
  "id": "op_demo0000000000000003",
  "execution_status": "partial",
  "verification_status": "failed",
  "recovery_status": "succeeded",
  "outcome": "partially_applied",
  "result_summary": {},
  "effects": [
    {
      "side_effect_id": "issue_created",
      "item_index": 0,
      "resource_uri": "issue://issue-tracker/issues/1002",
      "status": "applied",
      "source_version": "1",
      "detail": null
    },
    {
      "side_effect_id": "issue_created",
      "item_index": 1,
      "resource_uri": "issue://issue-tracker/issues/1003",
      "status": "applied",
      "source_version": "1",
      "detail": null
    },
    {
      "side_effect_id": "issue_created",
      "item_index": 2,
      "resource_uri": null,
      "status": "not_applied",
      "source_version": null,
      "detail": "item status failed"
    }
  ],
  "external_handle": "op_demo0000000000000003",
  "unresolved": false,
  "updated_at": "2026-10-22T14:00:02.500Z",
  "completed_at": "2026-10-22T14:00:01.250Z",
  "row_revision": 9
}
