{
  "protocol_version": "0.1",
  "plan_id": "pln_demo0000000000000001",
  "task_id": "tsk_demo0000000000000001",
  "action_id": "issues.update_owner",
  "principal": "agent@example-project.iam.gserviceaccount.com",
  "request_key_digest": "hmac-sha256:0a1b2c3d4e5f60718293a4b5c6d7e8f90a1b2c3d4e5f60718293a4b5c6d7e8f9",
  "attempts": 1,
  "cancel_requested": false,
  "recovers_operation_id": null,
  "recovery_operation_ids": [],
  "error": null,
  "created_at": "2026-10-22T14:00:00.000Z",
  "submitted_at": "2026-10-22T14:00:00.000Z",
  "id": "op_demo0000000000000001",
  "execution_status": "completed",
  "verification_status": "passed",
  "recovery_status": "none",
  "outcome": "verified",
  "result_summary": {
    "id": "1001",
    "owner": "bob",
    "status": "open",
    "version": 18
  },
  "effects": [
    {
      "side_effect_id": "owner_changed",
      "item_index": null,
      "resource_uri": "issue://issue-tracker/issues/1001",
      "status": "applied",
      "source_version": "18",
      "detail": null
    }
  ],
  "external_handle": "op_demo0000000000000001",
  "unresolved": false,
  "updated_at": "2026-10-22T14:00:02.500Z",
  "completed_at": "2026-10-22T14:00:01.250Z",
  "row_revision": 5
}
