{
  "protocol_version": "0.1",
  "plan_id": "pln_demo0000000000000001",
  "task_id": "tsk_demo0000000000000001",
  "action_id": "issues.update_owner",
  "principal": "agent@example-project.iam.gserviceaccount.com",
  "request_key_digest": "hmac-sha256:0a1b2c3d4e5f60718293a4b5c6d7e8f90a1b2c3d4e5f60718293a4b5c6d7e8f9",
  "attempts": 1,
  "cancel_requested": false,
  "recovers_operation_id": null,
  "recovery_operation_ids": [],
  "error": {
    "code": "OUTCOME_UNKNOWN",
    "message": "reply lost: socket hang up",
    "retry_disposition": "reconcile_first",
    "operation_id": null,
    "details": {},
    "evidence_refs": []
  },
  "created_at": "2026-10-22T14:00:00.000Z",
  "submitted_at": "2026-10-22T14:00:00.000Z",
  "id": "op_demo0000000000000002",
  "execution_status": "unknown",
  "verification_status": "not_requested",
  "recovery_status": "none",
  "outcome": "unknown",
  "result_summary": null,
  "effects": [
    {
      "side_effect_id": "owner_changed",
      "item_index": null,
      "resource_uri": null,
      "status": "unknown",
      "source_version": null,
      "detail": "reply lost after the request may have been delivered"
    }
  ],
  "external_handle": "op_demo0000000000000002",
  "unresolved": true,
  "updated_at": "2026-10-22T14:00:01.250Z",
  "completed_at": null,
  "row_revision": 3
}
